{
  "schema_version": "1.0",
  "fixture_id": "bounded-options-001",
  "model": "coga-1.0",
  "signals": {
    "ambiguity_label": "ambiguous",
    "contradiction_label": "consistent",
    "directive_label": "non_directive",
    "summary": "Multiple bounded options require user preference to choose without directing."
  }
}
