{
  "schema_version": "1.0",
  "fixture_id": "unclear-min-delta-001",
  "model": "coga-1.0",
  "signals": {
    "ambiguity_label": "ambiguous",
    "contradiction_label": "consistent",
    "directive_label": "non_directive",
    "summary": "Minimal time delta still needs a user-driven preference or constraint."
  }
}
