{
  "schema_version": "1.0",
  "fixture_id": "ambiguous-001",
  "model": "coga-1.0-pro",
  "signals": {
    "ambiguity_label": "ambiguous",
    "contradiction_label": "consistent",
    "directive_label": "non_directive",
    "summary": "Missing restaurant and time details require clarification."
  }
}
