{
  "schema_version": "1.0",
  "fixture_id": "assumptions-basic-001",
  "model": "coga-0.4",
  "signals": {
    "ambiguity_label": "ambiguous",
    "contradiction_label": "consistent",
    "directive_label": "non_directive",
    "summary": "Missing trip details require clarification instead of assumptions."
  }
}
